{
  "checked_at": "2026-10-12T04:21:36.151642Z",
  "continuous": true,
  "experiment_id": "kdc-smoke20-all-registered-final-20261012T074200",
  "kind": "CERTIFIED_CONTINUOUS",
  "message": null,
  "passed": true,
  "result_sha256": "3fb0173d28909af7ebc5abc181a5ba84b5440263780f130eeaccdd385faebaed",
  "run_id": "run_20261012T042135Z__sa__minmaxsum__st70-fa79167d4566-93e4a763b9__r00__97c9659dac0b",
  "schema_version": 1,
  "status": "PASSED",
  "verification_mode": "continuous"
}
