{
  "checked_at": "2026-10-12T04:21:35.166928Z",
  "continuous": true,
  "experiment_id": "kdc-smoke20-all-registered-final-20261012T074200",
  "kind": "CERTIFIED_CONTINUOUS",
  "message": null,
  "passed": true,
  "result_sha256": "8de8d731087a26240e4d9739a5f7fed7a7856b4d22518a90529986c82369562e",
  "run_id": "run_20261012T042134Z__lp-rounding__minmaxsum__st70-fa79167d4566-93e4a763b9__r00__b8bd97155ac8",
  "schema_version": 1,
  "status": "PASSED",
  "verification_mode": "continuous"
}
