{
  "checked_at": "2026-10-12T04:20:16.283505Z",
  "continuous": true,
  "experiment_id": "kdc-smoke20-all-registered-final-20261012T074200",
  "kind": "CERTIFIED_CONTINUOUS",
  "message": null,
  "passed": true,
  "result_sha256": "08e92b8332024a2e7969d1d902acbb78e97c16c4b02ed6ca340fd643fbc00f67",
  "run_id": "run_20261012T042015Z__local-search__minsum__gr96-a23a7ba30c4c-e195dfa06d__r00__380110d85e2f",
  "schema_version": 1,
  "status": "PASSED",
  "verification_mode": "continuous"
}
