{
  "checked_at": "2026-10-12T04:21:43.816729Z",
  "continuous": true,
  "experiment_id": "kdc-smoke20-all-registered-final-20261012T074200",
  "kind": "CERTIFIED_CONTINUOUS",
  "message": null,
  "passed": true,
  "result_sha256": "efb3112b77f204a7b8d2b2a10b39f9f3954737f17edab1e78852d0dc2d7536cb",
  "run_id": "run_20261012T042143Z__primal-dual__minmax__stars-0000030.instance-1955c914c741-2f__r00__f1532fa8f49e",
  "schema_version": 1,
  "status": "PASSED",
  "verification_mode": "continuous"
}
