{
  "checked_at": "2026-10-12T04:19:40.861097Z",
  "continuous": true,
  "experiment_id": "kdc-smoke20-all-registered-final-20261012T074200",
  "kind": "CERTIFIED_CONTINUOUS",
  "message": null,
  "passed": true,
  "result_sha256": "fa6a72aae5f91fde539ddd6d0c8a49c2b6fee63bc1622196c20b2e1417c4e3d8",
  "run_id": "run_20261012T041940Z__shifting__minmaxsum__att48-8efa61a1d9ab-5196644df6__r00__316cddb5226b",
  "schema_version": 1,
  "status": "PASSED",
  "verification_mode": "continuous"
}
