{
  "checked_at": "2026-10-12T04:19:38.477433Z",
  "continuous": true,
  "experiment_id": "kdc-smoke20-all-registered-final-20261012T074200",
  "kind": "CERTIFIED_CONTINUOUS",
  "message": null,
  "passed": true,
  "result_sha256": "f32bef829b475c3f61494a7cd3ce9a065eed6c28d2aac70688b2752956ca9114",
  "run_id": "run_20261012T041938Z__nn__minsum__C-right-8bf4b5770668-e0f2e6a705__r00__a99905a16a9a",
  "schema_version": 1,
  "status": "PASSED",
  "verification_mode": "continuous"
}
