{
  "checked_at": "2026-10-12T04:21:27.346101Z",
  "continuous": true,
  "experiment_id": "kdc-smoke20-all-registered-final-20261012T074200",
  "kind": "CERTIFIED_CONTINUOUS",
  "message": null,
  "passed": true,
  "result_sha256": "9fcd0300614a4e6e2906680745bc087964768d9d6271d73de3fb2d294265f9b6",
  "run_id": "run_20261012T042127Z__greedy__minmaxsum__sbgdb-20200507-fpg-poly_0000000030-749__r00__76d6eb848fd0",
  "schema_version": 1,
  "status": "PASSED",
  "verification_mode": "continuous"
}
