{
  "checked_at": "2026-10-12T04:29:01.642242Z",
  "continuous": false,
  "experiment_id": "kdc-smoke20-all-registered-final-20261012T074200",
  "kind": "NONE",
  "message": null,
  "passed": false,
  "result_sha256": "bbc86bdd215ac37b15038139f5667773d0e1bbac46ce6fc8e8149b1fffdd8400",
  "run_id": "run_20261012T042901Z__genetic__minmax__kroD100-100b54b48d61-5062f763b8__r00__0622251f593e",
  "schema_version": 1,
  "status": "FAILED",
  "verification_mode": "solver-reported"
}
