{
  "checked_at": "2026-10-12T04:20:03.650234Z",
  "continuous": true,
  "experiment_id": "kdc-smoke20-all-registered-final-20261012T074200",
  "kind": "CERTIFIED_CONTINUOUS",
  "message": null,
  "passed": true,
  "result_sha256": "ea2fd2d71c258a4d5495012f03aeb25c27b5109fdd8ca47d3395aedf488c8877",
  "run_id": "run_20261012T042003Z__nn__minmaxsum__euro-night-0000030-e7069adc74e0-164a85__r00__87cef848c06b",
  "schema_version": 1,
  "status": "PASSED",
  "verification_mode": "continuous"
}
