{
  "checked_at": "2026-10-12T04:21:06.220450Z",
  "continuous": true,
  "experiment_id": "kdc-smoke20-all-registered-final-20261012T074200",
  "kind": "CERTIFIED_CONTINUOUS",
  "message": null,
  "passed": true,
  "result_sha256": "2fcaddbacf3c4536af1acc4ad0c7f9a32adb2c71cd5d6937b937406a7ee61900",
  "run_id": "run_20261012T042105Z__lp-rounding__minsum__rat99-a364923ee329-1be1f1f758__r00__67147e878078",
  "schema_version": 1,
  "status": "PASSED",
  "verification_mode": "continuous"
}
