{
  "checked_at": "2026-10-12T04:29:10.741721Z",
  "continuous": false,
  "experiment_id": "kdc-smoke20-all-registered-final-20261012T074200",
  "kind": "NONE",
  "message": "ip-kont is registered but the native KONT/COPT backend is unavailable",
  "passed": false,
  "result_sha256": "f12fcfceb5eb05e07821fd9682a36309d1bd268a82df29377e9947551c2f5364",
  "run_id": "run_20261012T042910Z__ip-kont__minsum__kroE100-02a50775c87e-d8d2268527__r00__6f21f039462a",
  "schema_version": 1,
  "status": "NOT_RUN",
  "verification_mode": "not-run"
}
