{
  "checked_at": "2026-10-12T04:21:19.123147Z",
  "continuous": true,
  "experiment_id": "kdc-smoke20-all-registered-final-20261012T074200",
  "kind": "CERTIFIED_CONTINUOUS",
  "message": null,
  "passed": true,
  "result_sha256": "d25b9a7688c35b3b1248261900b9dbdf53525964617f94923d69a528b3b71382",
  "run_id": "run_20261012T042117Z__nn__minmaxsum__rd100-9407ab41999f-b9917bc5f5__r00__fa3ad72db464",
  "schema_version": 1,
  "status": "PASSED",
  "verification_mode": "continuous"
}
