{
  "checked_at": "2026-10-12T04:20:24.965733Z",
  "continuous": false,
  "experiment_id": "kdc-smoke20-all-registered-final-20261012T074200",
  "kind": "NONE",
  "message": null,
  "passed": false,
  "result_sha256": "0e81f6cc21b3fd06b7d5f12ec5270137ef7eb8a2e297e0790d9ce2be6b4f977d",
  "run_id": "run_20261012T042020Z__branch-and-bound__minmaxsum__kroD100-100b54b48d61-5062f763b8__r00__fe8d84811726",
  "schema_version": 1,
  "status": "FAILED",
  "verification_mode": "solver-reported"
}
