{
  "checked_at": "2026-10-12T04:28:45.210797Z",
  "continuous": false,
  "experiment_id": "kdc-smoke20-all-registered-final-20261012T074200",
  "kind": "NONE",
  "message": "ip-kont is registered but the native KONT/COPT backend is unavailable",
  "passed": false,
  "result_sha256": "37b93fb3e54213a3920a8b07a1ad8afe6705335c9bbf19142f7512302ea67741",
  "run_id": "run_20261012T042845Z__ip-kont__minmaxsum__berlin52-3939d9e3cc19-6ce5d7089a__r00__1d735640dadf",
  "schema_version": 1,
  "status": "NOT_RUN",
  "verification_mode": "not-run"
}
