{
  "checked_at": "2026-10-06T02:38:57.946161Z",
  "continuous": true,
  "experiment_id": "minmax-correctness-20261006-run02",
  "kind": "CERTIFIED_CONTINUOUS",
  "message": null,
  "passed": true,
  "result_sha256": "03c3ba9be9b4b37910cad047daf27e69852dd584deed92cc25c4d633194bfc30",
  "run_id": "run_20261006T023857Z__branch-and-bound__minmax__us-night-0000030.instance-3704ac03dc__r00__9edb3dd5e45b",
  "schema_version": 1,
  "status": "PASSED",
  "verification_mode": "continuous"
}
