{
  "checked_at": "2026-10-12T04:20:50.991031Z",
  "continuous": true,
  "experiment_id": "kdc-smoke20-all-registered-final-20261012T074200",
  "kind": "CERTIFIED_CONTINUOUS",
  "message": null,
  "passed": true,
  "result_sha256": "7574e005b50c880db57d9ef42c57e6715555603ac2de6a0d1b1b4a04e674f687",
  "run_id": "run_20261012T042050Z__lp-rounding__minmaxsum__pr76-4001f85eab1a-dc636944a6__r00__44bc35a06dcd",
  "schema_version": 1,
  "status": "PASSED",
  "verification_mode": "continuous"
}
