{
  "checked_at": "2026-10-12T04:21:28.321866Z",
  "continuous": true,
  "experiment_id": "kdc-smoke20-all-registered-final-20261012T074200",
  "kind": "CERTIFIED_CONTINUOUS",
  "message": null,
  "passed": true,
  "result_sha256": "c12885bf487157f88bb812de37cd116867373de60f4a8438adc63e827f68218a",
  "run_id": "run_20261012T042128Z__sa__minmax__sbgdb-20200507-pntset-0000030-ffc4aabe__r00__8e0013d19d51",
  "schema_version": 1,
  "status": "PASSED",
  "verification_mode": "continuous"
}
