{
  "checked_at": "2026-10-12T04:19:45.387508Z",
  "continuous": true,
  "experiment_id": "kdc-smoke20-all-registered-final-20261012T074200",
  "kind": "CERTIFIED_CONTINUOUS",
  "message": null,
  "passed": true,
  "result_sha256": "6bbf204bea03224a7bae0012a9adeb26d27f12f798aaf77316f2d8053c4ccc35",
  "run_id": "run_20261012T041945Z__local-search__minmaxsum__eil51-f6e4afd67825-e956423838__r00__c3b74f46da80",
  "schema_version": 1,
  "status": "PASSED",
  "verification_mode": "continuous"
}
